id,topic_category,sub_category,source_dataset,region,cultural_topic,user_message,ai_response,model,word_count_response,epistemic_positioning,pragmatic_appropriateness,ethical_handling,factual_accuracy,conversational_quality,overall_score,annotator_notes
me_001,medical,treatment,MedQuAD,,,What are the treatments for Parasites - African Trypanosomiasis (also known as Sleeping Sickness) ?,"All persons diagnosed with African Trypanosomiasis should receive treatment. The specific drug and treatment course will depend on the type of infection (T. b. gambiense or T. b. rhodesiense) and the disease stage (i.e. whether the central nervous system has been invaded by the parasite). Pentamidine, which is the recommended drug for first stage T. b. gambiense infection, is widely available in the U.S. The other drugs (suramin, melarsoprol, eflornithine, and nifurtimox) used to treat African trypanosomiasis are available in the U.S. only from the CDC. Physicians can consult with CDC staff for advice on diagnosis and management and to obtain otherwise unavailable treatment drug.
 
There is no test of cure for African trypanosomiasis. After treatment patients need to have serial examinations of their cerebrospinal fluid for 2 years, so that relapse can be detected if it occurs.
 
More on: Resources for Health Professionals: Treatment",human_expert,145,,,,,,,
me_002,medical,treatment,MedQuAD,,,What are the treatments for What I need to know about Interstitial Cystitis/Painful Bladder Syndrome ?,"No one treatment for IC/PBS has been found that works for everyone. Your doctor or nurse will work with you to find a treatment plan that meets your special needs. The plan may include diet and lifestyle changes, bladder retraining, activity and exercise, physical therapy, and various types of medicines. You should expect some treatment failures along the way, but, with time, you and your doctor or nurse should find a treatment that gives you some relief and helps you cope with your disease.
 
Diet and Lifestyle Changes
 
Some people with IC/PBS find that certain foods or drinks bring on their symptoms. Others find no link between symptoms and what they eat.
 
Learning what foods cause symptoms for you may require some trial and error. Keep a food diary and note the times you have bladder pain. The diary might reveal that your flare-ups always happen, for example, after you eat tomatoes or oranges.
 
Some doctors recommend taking an antacid medicine with meals. The medicine reduces the amount of acid that gets into the urine.
 
If you make changes to your diet, remember to eat a variety of healthy foods.
 
Bladder Retraining
 
Bladder retraining is a way to help your bladder hold more urine. People with bladder pain often get in the habit of using the bathroom as soon as they feel pain or urgency. They then feel the need to go before the bladder is really full. The body may get used to frequent voiding. Bladder retraining helps your bladder hold more urine before signaling the urge to urinate.
 
Keep a bladder diary to track how you are doing. Start by noting the times when you void. Note how much time goes by between voids. For example, you may find that you return to the bathroom every 40 minutes.
 
Try to stretch out the time between voids. If you usually void every 40 minutes, try to wait at least 50 minutes before you go to the bathroom.
 
If your bladder becomes painful, you may use the bathroom. But you may find that your first urge to use the bathroom goes away if you ignore it. Find ways to relax or distract yourself when the first urge strikes.
 
After a few days, you may be able to stretch the time out to 60 or 70 minutes, and you may find that the urge to urinate does not return as soon.
 
Activity
 
If you have IC/PBS, you may feel the last thing you want to do is exercise. But many people feel that easy activities like walking or gentle stretching exercises help relieve symptoms.
 
Physical Therapy
 
Your doctor or nurse may suggest pelvic exercises. The pelvic muscles hold the bladder in place and help control urination. The first step is to find the right muscle to squeeze. A doctor, nurse, or physical therapist can help you. One way to find the muscles is to imagine that you are trying to stop passing gas. Squeeze the muscles you would use. If you sense a ""pulling"" feeling, you have found the right muscles for pelvic exercises.
 
You may need exercises to strengthen those muscles so that it's easier to hold in urine. Or you may need to learn to relax your pelvic muscles if tense muscles are part of your bladder pain.
 
Some physical therapists specialize in helping people with pelvic pain. Ask your doctor or nurse to help you find a professional trained in pelvic floor physical therapy.
 
Reducing Stress
 
Stress doesn't cause IC/PBS. But stress can trigger painful flare-ups in someone who has IC/PBS. Learning to reduce stress in your life by making time for relaxation every day may help control some symptoms of IC/PBS.
 
Oral Medicines
 
Pain pills like aspirin, ibuprofen, or acetominophen can help control mild bladder pain. Advil and Motrin are examples of ibuprofen. Tylenol is an example of acetominophen. Talk with your doctor if you feel you need a stronger pain medicine.
 
Your doctor may recommend a medication, pentosan polysulfate sodium, sold as Elmiron, which is approved for treating the pain of IC/PBS. You may need to take this medicine for up to 6 months before you notice improvement. Elmiron does not work for everyone, but some people with IC/PBS have found relief taking it. You need a doctor's order for Elmiron. If you don't notice improvement of your symptoms in 6 months, this medicine is not likely to work.
 
Researchers are also looking at other kinds of medicines. Medicines that treat heartburn might help bladder symptoms by reducing the amount of acid made in the body. Muscle relaxants can keep the bladder from squeezing at the wrong time. Keeping the bladder muscle relaxed helps ease the symptoms of IC/PBS.
 
Bladder Stretching
 
The doctor may stretch the bladder by filling it with liquid. You will be given an anesthetic to prevent pain and help relax your bladder muscles. Some patients have said their symptoms were helped after this treatment.
 
Bladder Medicines
 
Many patients who have IC/PBS find relief after a treatment in which their bladders are filled with a liquid medicine. The doctor guides a tube into your bladder and slowly fills the bladder with a liquid that eases irritation of the bladder wall. The liquid may be a compound called DMSO or a solution that contains heparin and a pain medicine called lidocaine.
 
You will keep the liquid in your bladder for about 15 minutes and then release it. You can have this treatment once every week or every other week for 1 or 2 months. You may not feel any better until the third or fourth treatment.
 
Nerve Stimulation
 
If you have tried diet changes, exercise, and medicines and nothing seems to help, you may wish to think about nerve stimulation. This treatment sends mild electrical pulses to the nerves that control the bladder.
 
At first, you may try a system that sends the pulses through electrodes placed on your skin. If this therapy works for you, you may consider having a device put in your body. The device delivers small pulses of electricity to the nerves around the bladder.
 
For some patients, nerve stimulation relieves bladder pain as well as urinary frequency and urgency. For others, the treatment relieves frequency and urgency but not pain. For still other patients, it does not work.
 
Scientists are not sure why nerve stimulation works. Some believe that the electrical pulses block the pain signals carried in the nerves. If your brain doesn't receive the nerve signal, you don't feel the pain. Others believe that the electricity releases endorphins, which are hormones that block pain naturally.
 
Surgery
 
As a last resort, your doctor might suggest surgery to remove part or all of the bladder. Surgery does not cure the pain of IC/PBS in all cases, but if you have tried every other option and your pain is still unbearable, surgery might be considered.
 
Talk with your doctor and family about the possible benefits and side effects.",human_expert,1158,,,,,,,
me_003,medical,treatment,MedQuAD,,,What are the treatments for Kidney Failure: Choosing a Treatment That's Right for You ?,"If you have advanced chronic kidney disease (CKD), you may soon need treatment to do the work your kidneys can no longer do. Learning about your treatment options for kidney failure will help you make the best choice for you. Each treatment has pros and cons. Your choice of treatment will have a big effect on your daily life, such as continuing to work if you do so currently. Talking with your doctor ahead of time about your options can help you take control of your care. Understanding the treatment you choose and getting used to the idea that you need to have this treatment takes time. If you find your choice of treatment does not fit your lifestyle, talk with your doctor about picking another treatment that fits your needs better.",human_expert,132,,,,,,,
me_004,medical,symptoms,MedQuAD,,,What are the symptoms of Hepatitis B: What Asian and Pacific Islander Americans Need to Know ?,"Hepatitis B is called a silent killer because many people have no symptoms, so the disease often progresses unnoticed for years. Unfortunately, many people first learn they have chronic hepatitis B when they develop symptoms of severe liver damage, which include
 
- yellowish eyes and skin, called jaundice - a swollen stomach or ankles - tiredness - nausea - weakness - loss of appetite - weight loss - spiderlike blood vessels, called spider angiomas, that develop on the skin",human_expert,79,,,,,,,
me_005,medical,treatment,MedQuAD,,,What are the treatments for What I need to know about My Child's Urinary Tract Infection ?,"Bacteria-fighting medicines called antibiotics are used to treat a UTI. While the lab is doing the urine culture, the health care provider may begin treatment with an antibiotic that treats the bacteria most likely to be causing the infection. Once culture results are known, the health care provider may switch your child to a different antibiotic that targets the specific type of bacteria.
 
Your child will need to take antibiotics for at least 3 to 5 days and maybe as long as several weeks. Be sure your child takes every pill or every dose of liquid. Your child should feel better after a couple of days, but the infection might come back if your child stops taking the antibiotic too early.
 
You should let your child drink as much as your child wants. But dont force your child to drink large amounts of fluid. Call your childs health care provider if your child doesnt want to or isnt able to drink. Also, talk with your childs health care provider if your child needs medicine for the pain of a UTI. The health care provider can recommend an over-the-counter pain medicine. A heating pad on the back or abdomen may also help.",human_expert,201,,,,,,,
me_006,medical,prevention,MedQuAD,,,How to prevent What I need to know about My Child's Urinary Tract Infection ?,"You can take the following steps to help prevent your child from getting a UTI:
 
- Teach your child not to hold in urine and to go to the bathroom whenever your child feels the urge. - Teach your child how to properly clean himself or herself after using the bathroom to keep bacteria from entering the urinary tract. - Have your child wear loose-fitting clothes. Tight clothes can trap moisture, which allows bacteria to grow. - Buy your child cotton underwear. Cotton lets in air to dry the area. - If your child has constipation, talk with a health care provider about the best treatment options.",human_expert,107,,,,,,,
me_007,medical,treatment,MedQuAD,,,What are the treatments for What I need to know about Bladder Control for Women ?,"Your doctor will likely offer several treatment choices. Some treatments are as simple as changing some daily habits. Other treatments require taking medicine or using a device. If nothing else seems to work, surgery may help a woman with stress incontinence regain her bladder control.
 
Talk with your doctor about which treatments might work best for you.
 
Pelvic Muscle Strengthening
 
Many women prefer to try the simplest treatment choices first. Kegel exercises strengthen the pelvic muscles and don't require any equipment. Once you learn how to ""Kegel,"" you can Kegel anywhere. The trick is finding the right muscles to squeeze. Your doctor or nurse can help make sure you are squeezing the right muscles. Your doctor may refer you to a specially trained physical therapist who will teach you to find and strengthen the sphincter muscles. Learning when to squeeze these muscles can also help stop the bladder spasms that cause urge incontinence. After about 6 to 8 weeks, you should notice that you have fewer leaks and more bladder control. Use the pelvic muscle exercise log included with the Kegel Exercise Tips sheet (Item C) to keep track of your progress.
 
Changing Habits
 
Timed voiding. By keeping track of the times you leak urine, you may notice certain times of day when you are most likely to have an accident. You can use that information to make planned trips to the bathroom ahead of time to avoid the accident. Once you have established a safe pattern, you can build your bladder control by stretching out the time between trips to the bathroom. By forcing your pelvic muscles to hold on longer, you make those muscles stronger.
 
Diet changes. You may notice that certain foods and drinks cause you to urinate more often. You may find that avoiding caffeinated drinks like coffee, tea, or cola helps your bladder control. You can choose the decaf version of your favorite drink. Make sure you are not drinking too much fluid because that will cause you to make a large amount of urine. If you are bothered by nighttime urination, drink most of your fluids during the day and limit your drinking after dinner. You should not, however, avoid drinking fluids for fear of having an accident. Some foods may irritate your bladder and cause urgency. Talk with your doctor about diet changes that might affect your bladder.
 
Weight loss. Extra body weight puts extra pressure on your bladder. By losing weight, you may be able to relieve some of that pressure and regain your bladder control.
 
Medicines
 
No medications are approved to treat stress urinary incontinence. But if you have an overactive bladder, your doctor may prescribe a medicine that can calm muscles and nerves. Medicines for overactive bladder come as pills, liquid, or a patch.
 
Medicines to treat overactive bladder can cause your eyes to become dry. These medicines can also cause dry mouth and constipation. If you take medicine to treat an overactive bladder, you may need to take steps to deal with the side effects.
 
- Use eye drops to keep your eyes moist. - Chew gum or suck on hard candy if dry mouth bothers you. Make it sugarless gum or candy to avoid tooth decay. - Take small sips of water throughout the day.
 
Medicines for other conditions also can affect the nerves and muscles of the urinary tract in different ways. Pills to treat swelling-edema-or high blood pressure may increase urine output and contribute to bladder control problems.
 
Talk with your doctor; you may find that taking a different medicine solves the problem without adding another prescription. The list of Medicines for Bladder Control (Item D) will give you more information about specific medicines.
 
Pessaries
 
A pessary is a plastic ring, similar to a contraceptive diaphragm, that is worn in the vagina. It will help support the walls of the vagina, lifting the bladder and nearby urethra, leading to less stress leakage. A doctor or nurse can fit you with the best shape and size pessary for you and teach you how to care for it. Many women use a pessary only during exercise while others wear their pessary all day to reduce stress leakage. If you use a pessary, you should see your doctor regularly to check for small scrapes in the vagina that can result from using the device.
 
Nerve Stimulation
 
Electrical stimulation of the nerves that control the bladder can improve symptoms of urgency, frequency, and urge incontinence, as well as bladder emptying problems, in some people. This treatment is usually offered to patients who cannot tolerate or do not benefit from medications. At first, your doctor will use a device outside your body to deliver stimulation through a wire implanted under your skin to see if the treatment relieves your symptoms. If the temporary treatment works well for you, you may be able to have a permanent device implanted that delivers stimulation to the nerves in your back, much like a pacemaker. The electrodes in the permanent device are placed in your lower back through a minor surgical procedure. You may need to return to the doctor for adjustments to find the right setting that controls your bladder symptoms.
 
Surgery
 
Doctors may suggest surgery to improve bladder control if other treatments have failed. Surgery helps only stress incontinence. It won't work for urge incontinence. Many surgical options have high rates of success.
 
Most stress incontinence problems are caused by the bladder neck dropping toward the vagina. To correct this problem, the surgeon raises the bladder neck or urethra and supports it with a ribbon-like sling or web of strings attached to a muscle or bone. The sling holds up the bottom of the bladder and the top of the urethra to stop leakage.
 
Catheterization
 
If your bladder does not empty well as a result of nerve damage, you might leak urine. This condition is called overflow incontinence. You might use a catheter to empty your bladder. A catheter is a thin tube you can learn to insert through the urethra into the bladder to drain urine. You may use a catheter once in a while, a few times a day, or all of the time. If you use the catheter all the time, it will drain urine from your bladder into a bag you can hang from your leg. If you use a catheter all the time, you should watch for possible infections.",human_expert,1071,,,,,,,
me_008,medical,prevention,MedQuAD,,,How to prevent Am I at Risk for Type 2 Diabetes? Taking Steps to Lower Your Risk of Getting Diabetes ?,"Yes. The results of the Diabetes Prevention Program (DPP) proved that weight loss through moderate diet changes and physical activity can delay or prevent type 2 diabetes. The DPP was a federally funded study of 3,234 people at high risk for diabetes. This study showed that a 5-to 7-percent weight loss, which for a 200-pound person would be 10 to 14 pounds, slowed development of type 2 diabetes.
 
People at High Risk for Diabetes
 
DPP study participants were overweight and had higher than normal levels of blood glucose, a condition called prediabetes. Many had family members with type 2 diabetes. Prediabetes, obesity, and a family history of diabetes are strong risk factors for type 2 diabetes. About half of the DPP participants were from minority groups with high rates of diabetes, including African Americans, Alaska Natives, American Indians, Asian Americans, Hispanics/Latinos, and Pacific Islander Americans.
 
DPP participants also included others at high risk for developing type 2 diabetes, such as women with a history of gestational diabetes and people age 60 and older.
 
Approaches to Preventing Diabetes
 
The DPP tested three approaches to preventing diabetes:
 
- Making lifestyle changes. People in the lifestyle change group exercised, usually by walking 5 days a week for about 30 minutes a day, and lowered their intake of fat and calories. - Taking the diabetes medicine metformin. Those who took metformin also received information about physical activity and diet. - Receiving education about diabetes. The third group only received information about physical activity and diet and took a placeboa pill without medicine in it.
 
People in the lifestyle change group showed the best outcomes. But people who took metformin also benefited. The results showed that by losing an average of 15 pounds in the first year of the study, people in the lifestyle change group reduced their risk of developing type 2 diabetes by 58 percent over 3 years. Lifestyle change was even more effective in those age 60 and older. People in this group reduced their risk by 71 percent. But people in the metformin group also benefited, reducing their risk by 31 percent. More information about the DPP, funded under National Institutes of Health (NIH) clinical trial number NCT00004992, is available at www.bsc.gwu.edu/dpp.
 
Lasting Results
 
The Diabetes Prevention Program Outcomes Study (DPPOS) has shown that the benefits of weight loss and metformin last for at least 10 years. The DPPOS has continued to follow most DPP participants since the DPP ended in 2001. The DPPOS showed that 10 years after enrolling in the DPP,
 
- people in the lifestyle change group reduced their risk for developing diabetes by 34 percent - those in the lifestyle change group age 60 or older had even greater benefit, reducing their risk of developing diabetes by 49 percent - participants in the lifestyle change group also had fewer heart and blood vessel disease risk factors, including lower blood pressure and triglyceride levels, even though they took fewer medicines to control their heart disease risk - the metformin group reduced the risk of developing diabetes by 18 percent
 
Even though controlling your weight with lifestyle changes is challenging, it produces long-term health rewards by lowering your risk for type 2 diabetes, lowering your blood glucose levels, and reducing other heart disease risk factors. More information about the DPPOS, funded under NIH clinical trial number NCT00038727, can be found at www.bsc.gwu.edu/dpp.
 

 
Other Types of Diabetes In addition to type 2, the other main types of diabetes are type 1 diabetes and gestational diabetes. Type 1 Diabetes Type 1 diabetes, formerly called juvenile diabetes, is usually first diagnosed in children, teenagers, and young adults. In this type of diabetes, your pancreas can no longer make insulin because your bodys immune system has attacked and destroyed the cells that make it. Treatment for type 1 diabetes includes taking insulin shots or using an insulin pump, making wise food choices, being physically active on a regular basis, controlling blood pressure and cholesterol, and, for some, taking aspirin daily. Gestational Diabetes Gestational diabetes is a type of diabetes that develops only during pregnancy. Hormones produced by your placenta and other pregnancy-related factors contribute to insulin resistance, which occurs in all women during late pregnancy. Insulin resistance increases the amount of insulin needed to control blood glucose levels. If your pancreas cant produce enough insulin, gestational diabetes occurs. As with type 2 diabetes, excess weight is linked to gestational diabetes. Overweight or obese women are at particularly high risk for gestational diabetes because they start pregnancy with a higher need for insulin due to insulin resistance. Excessive weight gain during pregnancy may also increase risk. Gestational diabetes occurs more often in some ethnic groups and among women with a family history of diabetes. Although gestational diabetes usually goes away after the baby is born, a woman who has had gestational diabetes is more likely to develop type 2 diabetes later in life. Babies born to mothers who had gestational diabetes are also more likely to develop obesity and type 2 diabetes as they grow up.",human_expert,842,,,,,,,
me_009,medical,symptoms,MedQuAD,,,What are the symptoms of Am I at Risk for Type 2 Diabetes? Taking Steps to Lower Your Risk of Getting Diabetes ?,"The signs and symptoms of type 2 diabetes can be so mild that you might not even notice them. Nearly 7 million people in the United States have type 2 diabetes and dont know they have the disease. Many have no signs or symptoms. Some people have symptoms but do not suspect diabetes.
 
Symptoms include
 
- increased thirst - increased hunger - fatigue - increased urination, especially at night - unexplained weight loss - blurred vision - numbness or tingling in the feet or hands - sores that do not heal
 
Many people do not find out they have the disease until they have diabetes problems, such as blurred vision or heart trouble. If you find out early that you have diabetes, you can get treatment to prevent damage to your body.",human_expert,132,,,,,,,
