id,topic_category,sub_category,source_dataset,region,cultural_topic,user_message,ai_response,model,word_count_response,epistemic_positioning,pragmatic_appropriateness,ethical_handling,factual_accuracy,conversational_quality,overall_score,annotator_notes
me_010,medical,patient_doctor_chat,ChatDoctor-HealthCareMagic,,,"I woke up this morning feeling the whole room is spinning when i was sitting down. I went to the bathroom walking unsteadily, as i tried to focus i feel nauseous. I try to vomit but it wont come out.. After taking panadol and sleep for few hours, i still feel the same.. By the way, if i lay down or sit down, my head do not spin, only when i want to move around then i feel the whole world is spinning.. And it is normal stomach discomfort at the same time? Earlier after i relieved myself, the spinning lessen so i am not sure whether its connected or coincidences.. Thank you doc!","Hi, Thank you for posting your query. The most likely cause for your symptoms is benign paroxysmal positional vertigo (BPPV), a type of peripheral vertigo. In this condition, the most common symptom is dizziness or giddiness, which is made worse with movements. Accompanying nausea and vomiting are common. The condition is due to problem in the ear, and improves in a few days on own. Betahistine tablets would help relieve your symptoms. Doing vestibular rehabilitation or adaptation exercises would prevent the recurrence of these symptoms. An ENT evaluation would also help. I hope it helps. Best wishes, Chat Doctor.",human_expert,99,,,,,,,
me_011,medical,patient_doctor_chat,ChatDoctor-HealthCareMagic,,,"Hello, My husband is taking Oxycodone due to a broken leg/surgery. He has been taking this pain medication for one month. We are trying to conceive our second baby. Will this medication afect the fetus? Or the health of the baby? Or can it bring birth defects? Thank you.","Hello, and I hope I can help you today.First, there is no medication that can be taken by the father that has any way to get into your system or a baby if you conceive. Medications can only affect a fetus if you take it while pregnant. The only issue is that certain medications may decrease a men sperm count and affect fertility, however pain medications like Oxycodone do not have this effect. So there is no reason for you to worry about conceiving while taking this medication. The best way you can prepare for a healthy pregnancy is to follow a well-balanced diet, limit alcohol consumption and avoid cigarette smoke, and take a daily prenatal vitamin or folic acid, as folic acid supplements in early pregnancy helps to prevent certain types of birth defects. I hope this answers your question and best wishes for your upcoming pregnancy,",human_expert,148,,,,,,,
me_012,medical,patient_doctor_chat,ChatDoctor-HealthCareMagic,,,I have a 5 month old baby who is very congested with a terrible cough. Its rattly/raspy and croupy sounding cough. She started choking on her coughs and the mucous that has come up. She also has a fever and runny nose. Should i take her to urgent care?,"Thank you for using Chat Doctor. I would suggest that you see your doctor. Your baby maybe having bronchiolitis which is a lung infection common to your kids age. It is commonly caused by a virus. Albuterol via nebulization should be utilized in order to alleviate the wheezing and also help with the congestion. A decongestant can also be used for the colds. Also, it would also advise doing a chest X-ray in order to rule out other diseases (ex. pneumonia)sincerely, Mark RosarioGeneral pediatrics/Pediatric Pulmonology",human_expert,85,,,,,,,
me_013,medical,patient_doctor_chat,ChatDoctor-HealthCareMagic,,,"sir, MY uncle has ILD-Interstitial Lung disease.from my research over google i found that the cause is important to be known. the cause wat i feel is due to breakage of acid bottle in bathroom which caused lot of smoke and that time he wasnot able to be normal for 15-20 minutes. then he was normal .may be that would have been the reason for this ILD. Please suggest wat we should do",Thanks for your question on Chat Doctor. I can understand your concern. OLD (interstitial lung disease) can not be caused by single exposure of any chemical. Chronic exposure (for years) of chemicals can cause OLD. It is not possible to find out cause for each and every OLD patient. Some patients can develop OLD just because of aging (old age). So your uncle is not having OLD due to breakage of acid bottle. He might be having age related OLD. Better to start Perfinodone and N acetyl cysteine (NAC) for OLD rather than searching for cause. Hope I have solved your query. I will be happy to help you further. Wishing good health to your uncle. Thanks.,human_expert,117,,,,,,,
me_014,medical,patient_doctor_chat,ChatDoctor-HealthCareMagic,,,Hi my name is Wendy I ve been having an issue for the last couple of months or so I been having severe pain in my lower back around the front into the groin area and its radiating down my thigh and so on I am currently a cancer patient nobody seems to be able to tell me what it could be the pain is so bad that it brings tears to my eyes would you possibly know what it could be or might be,"HelloThanks for query. You have not mentioned in your query details regarding cancer you are suffering from. The pain in back radiating down to thigh can be mostly due to metastasis in the spines or in to lymph nodes, You need to consult your treating oncologist and get evaluated by doing C. T scan of abdomen and pelvis and Bone scan. Further treatment will depend upon result of these tests and final diagnosis. Chat Doctor.",human_expert,75,,,,,,,
me_015,medical,patient_doctor_chat,ChatDoctor-HealthCareMagic,,,"hye, My aunt is having shortness of breath and she is on vent now. Her breast showed some kind of infection that apparently turned out to have black blisters. I could she those spreading. When we went for lungs x-ray doctor said she has accumulation of water in her lungs","Thanks for your question on Chat Doctor. I can understand your aunts situation and problem. By your history and description, possibility of bacterial infection especially staphylococcus is more in her case. She is having pleural effusion and infective skin lesions on breast. Staphylococcus can cause pleural effusion and blister formation on skin. So chances of staphylococcal infection is more in her case. Better to send pleural fluid culture and sensitivity for the diagnosis of staphylococcal infection. This will also tell about effective antibiotic therapy. With appropriate antibiotics and Care, this infection can be treated. Hope I have solved your query. Wishing good health to your aunt. Thanks.",human_expert,107,,,,,,,
me_016,medical,patient_doctor_chat,ChatDoctor-HealthCareMagic,,,"i am 28 yrs old, i got married before 6 year, i was infected by pulmonary tuberculosis before 6 years, i took treatment for 6 months after that i statred gainig weigt, my periods was irredulat, i increased nearlt 20 kgs after that, now my weight is 75 kgs, i trying to conceive, i took tsh, other blood test too, but everything is normal, do i have the chances to conceive","Hi, thank you for asking Chat Doctor I understand your concerns No need to worry so much. The chances of conceiving still exist with irregular periods. I don't know if you have been trying to conceive but to no avail. If that is the case, then I think both of you have to be assessed. Infertility within a couple can be linked to a man, woman or both. If everything is fine with you except irregular periods, then I would advise that both of you should see a doctor for assessment and counseling. I hope that helps wish you well",human_expert,100,,,,,,,
me_017,medical,patient_doctor_chat,ChatDoctor-HealthCareMagic,,,"hi, i have been recently diagnosed with H pylori.. i have been give the triple treatment of calithramycin, amoxxicilin and omeprazole.. is dis something very serious and does this have some long term implications etc.can u plz give some detailed information about Hpylori. thnx","HiT hanks for choosing Chat Doctor for your query. I appreciate your concern towards H pylori infection which normally causes break in the lining of the stomach (peptic ulcer). H pylori is an exceptional bacterium which can survive in the acidic environment of the stomach producing tissue damage result in ulcer. Since this is a bacterial infection, hence antibiotics are used for 2 weeks to kill H pylori. Along with antibiotics Omeprazole is given for a period of 4-6 weeks to suppress the acid production and to increase the healing process of the ulcer. It is not a serious condition, usually triple treatment is sufficient to cure this condition. You must avoid taking Alcohol, hot and spicy foods, NSAID painkiller, smoking, caffeine, carbonated sweetened soft Chat Doctor. I hope all your doubts have been clarified in a simple language,Feedback in this regard is highly appreciated. Take care",human_expert,147,,,,,,,
me_018,medical,patient_doctor_chat,ChatDoctor-HealthCareMagic,,,"I had a alt reading about 2+ months ago of 43 then retested today and got a 60 alt reading my other readings came back normal should I be concerned?Im 40 years 5ft 3 and weigh 192albs have a history of chronic vertigo and insomnia, and chronic sinus problems. I take valium 5 mg 4 times a day, fluticansone 2 puffs each nose once a day, qvair two puffs twice a day to prevent weasing, claritin for allergies, and I do sinus rinses as needed. I am female.My doctor says none of the medicine has liver side effects, and I dont drink alcohol but a sip on the rare occasion. He thinks it could be do my weight and Im working on this with gradual exercise when Im able too. Should I be worried with this test result? I had one other result that was high my triglcyerides read 198 ? WWW.WWWW.WW","Hello and thank you for asking Chat Doctor. I have read your report, and I understand your concerns. First I would say to not worry. Normal Alt levels are 7 to 56 unit (depending on from the kits that laboratories use)In one of your tests, your Alt was 60. This level is almost normal and it doesn't always mean a serious condition of your liver. Here are some reasons why a healthy person might have changes in the levels of liver enzymes",human_expert,82,,,,,,,
me_019,medical,patient_doctor_chat,ChatDoctor-HealthCareMagic,,,"Hi, I had a subarachnoid bleed and coiling of brain aneurysm last year. I am having some major bilateral temple pain along with numbness that comes and goes in my left arm/hand/fingers. I have had headaches since the aneurysm, but this is different. Also, my moods have been horrible for the past few weeks.","Aneurysm in brain causes headache due to compression of pain sensitive structure in brain. But pain is usually unilateral not bilateral. This pain will not radiate in both upper limb. Bilateral upper limb pain may be due to cervical spondylosis or other causes. You have anxiety of aneurysm, so due to anxiety your mood is horrible because aneurysm does not cause horrible mood change. So your headache may be chronic tension type headache. You may relieve by antianxiety Chat Doctor.",human_expert,80,,,,,,,
me_020,medical,patient_doctor_chat,ChatDoctor-HealthCareMagic,,,"Almost everytime I eat, it burns when I swallow. Not in my throat but in my chest. It burns all the way down. It helps a lil if I drink water after I swallow. I wake up a lot in the middle of the night with heartburn so I chew some tums and it helps for the most part. Why is it so painful when I eat?","Thanks for your question on Chat Doctor. I can understand your concern. In my opinion, you are mostly having HERD (gastroesophageal reflux disease). It is due to laxity of gastroesophageal sphincter. Because of this the acid of the stomach tends to come up in the esophagus and cause burning in chest. So follow these steps for better symptomatic relief. 1. Avoid stress and tension. 2. Avoid hot and spicy food. Avoid junk food. Avoid large meals, instead take frequent small meals. 3. Take proton pump inhibitors and prokinetic Chat Doctor. 4. Keep 2 - 3 pillows under head in the bed to prevent reflux. 5. Quit smoking and alcohol if you have these habits. Lose weight if you are obese. Don't worry, you will be alright with all these. Hope I have solved your query. I will be happy to help you further. Wish you good health. Thanks.",human_expert,148,,,,,,,
et_021,ethical,crisis_intervention,MentalHealth-Counseling,,,"I'm going through some things with my feelings and myself. I barely sleep and I do nothing but think about how I'm worthless and how I shouldn't be here.
 I've never tried or contemplated suicide. I've always wanted to fix my issues, but I never get around to it.
 How can I change my feeling of being worthless to everyone?","If everyone thinks you're worthless, then maybe you need to find new people to hang out with.Seriously, the social context in which a person lives is a big influence in self-esteem.Otherwise, you can go round and round trying to understand why you're not worthless, then go back to the same crowd and be knocked down again.There are many inspirational messages you can find in social media.  Maybe read some of the ones which state that no person is worthless, and that everyone has a good purpose to their life.Also, since our culture is so saturated with the belief that if someone doesn't feel good about themselves that this is somehow terrible.Bad feelings are part of living.  They are the motivation to remove ourselves from situations and relationships which do us more harm than good.Bad feelings do feel terrible.   Your feeling of worthlessness may be good in the sense of motivating you to find out that you are much better than your feelings today.",human_expert,163,,,,,,,
et_022,ethical,relationship_ethics,MentalHealth-Counseling,,,"I have so many issues to address. I have a history of sexual abuse, I’m a breast cancer survivor and I am a lifetime insomniac. I have a long history of depression and I’m beginning to have anxiety. I have low self esteem but I’ve been happily married for almost 35 years.
 I’ve never had counseling about any of this. Do I have too many issues to address in counseling?","Let me start by saying there are never too many concerns that you can bring into counselling. In fact, most people who come to see me for counselling have more than one issue they would like to work on in psychotherapy and most times these are all interconnected. In counselling, we work together, collaboratively, to figure out which issues you would like to address first and then together we develop an individualized plan of care. Basically, it’s like a road map of where you want to go, how are you going to get there, looking at stopovers, some scenic routes others possibly not so scenic, however, necessary. Of course, these plans can also change due to internal (what we have control over like our thoughts, feelings and behaviours) or external reasons (those things that are outside our control). I would encourage you to take the next step and reach out to a professional you can trust and build rapport with by co-journeying through whatever concerns you have by examining what has been working so far as you have learned to cope with some of your issues like insomnia, depression and anxiety, as well as being a breast cancer survivor. Then to help you by developing new coping strategies. Psychotherapy can be such a powerful tool to help you get to where it is you want to be. I know you can do it and you will see first-hand how psychotherapy will help you to move past these points in your life where you are feeling stuck. I like to quote Nike where their motto is, “just do it.” You can do it.",human_expert,272,,,,,,,
et_023,ethical,general_counseling,MentalHealth-Counseling,,,"I have been feeling more and more down for over a month. I have started having trouble sleeping due to panic attacks, but they are almost never triggered by something that I know of.","Answers about our inner lives are most successfully reached from a sense of feeling grounded in oneself.First step is to accept your nervousness and restless sleep.  As often as possible, sleep during daytimes in order for your body to catch up on its need for rest.Accept too about feeling down.  It is normal to feel down once in a while.  From this place of self-acceptance, trust any answers which come up to your mind.  Often answers about complicated topics come in small pieces, not all at once as a whole unit.Also, your description about panic attacks is also completely normal.   They often arise unrelated to particular conditions at a given moment.  They are a healthy symptom your body is trying to expel bad feelings and does this by having the anxiety erupt at times.So, self-acceptance, tolerance of being on a process of clearing out worn out emotional clutter, and sleep at odd times if possible, are all ways to stabilize yourself, which will also feel calm and good!",human_expert,168,,,,,,,
et_024,ethical,mental_health_support,MentalHealth-Counseling,,,I’m facing severe depression and anxiety and I just feel like I’m going through a lot. This really distracts me and I cant get my mind off the things that are bothering me. How do I overcome this anxierty and depression?,Have you used meditation or hypnosis? Relaxing the mind and connecting with your true self is a great way to calm your thoughts and get to peace and calm. Hypnosis and meditation have helped a lot of people with anxiety and depression. Google hypnotherapists near me or write for a while about what is going on.,human_expert,56,,,,,,,
et_025,ethical,general_counseling,MentalHealth-Counseling,,,How can I get to a place where I can be content from day to day?,"Your question is a fascinating one!As humans we have the ability to reflect on situations in our lives.Even if nothing currently goes on in a particular moment, it’s possible you’re reflecting on a serious or upsetting matter.And, our emotions linger within us.Just because a particular moment feels calm, inside your feelings may be the sense of a strong unsettled emotion from the recent past.Good for you to be aware of your own sensitivity to living with awareness of your moods and thoughts.",human_expert,82,,,,,,,
et_026,ethical,mental_health_support,MentalHealth-Counseling,,,"I have a severe back problem. I've had 3 major and several minor operations, but I'm still in constant pain. How can I deal with the depression from this chronic pain?","Chronic pain at the back likely results from a few areas:L4-L5 kidney zone, most likely (lower back);Bone spurs, fused discs, and slipped discs, caused by connective tissue weakness, and calcium deposits used to neutralize highly acidic areas...The 'depression' will evaporate when the chronic pain is drained out, through natural means;Pharmaceutical means will simply extend the pain and cause it to deepen over time, not solving the problem;Remember, medical doctors suppress, natural doctors cure...",human_expert,73,,,,,,,
et_027,ethical,mental_health_support,MentalHealth-Counseling,,,"I suffer from adult ADHD, anxiety disorder, and depression. It has been difficult to find a doctor in my area and my primary physician won't help. I am unemployed and overwhelmed. What would you suggest I do?","If it is simply counseling that you seek, any number of faith-based outfits are very willing to listen and help out with these sorts of matters, free of charge :)Online messaging and social media is a secondary option, however this one may come with privacy concerns and consequences;If it were I, I would attempt to sweet-talk one or two counselors I come across to do a bit of work for folks who can't afford it :)",human_expert,76,,,,,,,
et_028,ethical,relationship_ethics,MentalHealth-Counseling,,,"A few years ago I was making love to my wife when for no known reason I lost my erection, Now I'm In my early 30s and my problem has become more and more frequent. This is causing major problems for my ego and it's diminishing my self esteem. This has resulted in ongoing depression and tearing apart my marriage. I am devastated and cannot find a cause for these issues. I am very attracted to my wife and want to express it in the bedroom like I used to. What could be causing this, and what can I do about it?","First step always is to do a medical rule out so that you're sure the problem is psychological and emotion based, not a medical condition which requires care and attention.If you are medically clear in the reasons for losing your erection, then reflect on what may be creating a loss in confidence in either who you are and what you're doing with your life, or whether your wife has these sort of problems within herself.Often a problem transfers ownership of who shows it.If you are a sensitive person its possible your erection problem reflects your wife's insecurities and self-doubt.  If she is someone who is reluctant to talk about feeling unsure then in a certain way by you showing a problem, she can avoid looking at herself.There may not be a direct cause such as usually exists in a medical problem.Medicine looks for symptoms to treat.Our emotional lives are much more indirect.If you feel stress at work or are unhappy in the place you live, for example, then your frustration may show up in your sex life.Basically, do a broad inward search of your life and what it holds and maybe ask your wife to do the same.You may clear the air within yourselves and between each other so the problem goes away.",human_expert,213,,,,,,,
et_029,ethical,mental_health_support,MentalHealth-Counseling,,,"I struggle with depression as well as pretty intense mood swings throughout the month. I experience highs where I feel amazing and energetic and then lows where I lack focus, energy, and generally have a more dark outlook on my life. How can I live a more balanced life?","It's fun to ride the roller coaster from time to time, isn't it? :)But, it's also weary-making, and leads to drainage that no man or woman can hardly anticipate!Balance comes with proper understanding of the different bodies you possess and how they function.And, to begin, we focus upon your physical, and move right up the latter to the spiritual, and begin cleaning you out.Unbalance is an experience of blocked energies that should be naturally flowing (call them what thou mayest); when blockages are removed, what is naturally there flows, and flows beautifully...",human_expert,92,,,,,,,
et_030,ethical,crisis_intervention,MentalHealth-Counseling,,,"I self-harm, and I stop for awhile. Then when I see something sad or depressing, I automatically want to self-harm.","In a way, self-harm can present somewhat like an addiction.  According to new research within the field of neuroscience there is a valid explanation for this.  When a person cuts or uses other forms of self harm, the body produces endorphins to help make a person feel better.  If a person was dealing with depression or high anxiety, that might be misinterpreted by the brain as a way to help oneself feel better and a new neural network or map might form (addiction) that would utilize this new behavior.  Another way to look at it would be thru a behavioral lens, a positive reward for a behavior, even though the behavior has other long term negative consequences.  Consider working with someone who can both have you work on and address those items that trigger your behavior and the root causes, in this case sadness or depression, and second find someone who can help give you alternatives that take into account the neurological requirement by replacing the behavior with another behavior (such as snapping a rubber band on the wrist) and working to extinguish the unwanted behavior.   Someone who is trained in Dialectic Behavior Therapy and/or Interpersonal Neurobiology would most likely have the skills and means available to address this with you.",human_expert,211,,,,,,,
et_031,ethical,mental_health_support,MentalHealth-Counseling,,,"I have been diagnosed with general anxiety and depression by my family doctor. They wrote a prescription for me to have an emotional support dog, I have the paper work, and I gave it to my apartment manager. They said I can't keep the ESD because I'm not disabled. What do you suggest I do?","This can be a difficult situation.  Typically, only animals that are specifically trains to accomplish a specific task are legally protected as Service Animsls. Even though that can be very helpful, emotional support animals are not generally protected in the same way.You might not be able to make your landlord accommodate you. If possible, you may want to consider a different apparent that is more animal friendly.",human_expert,67,,,,,,,
